{
  "schema_version": "1.0",
  "experiment_id": "BASE_OVERLAP",
  "variant": "BASE",
  "runtime_profile": "creator-0.11.272",
  "name": "JPEG_BASE_OVERLAP",
  "shape": "Round",
  "profit_factor": 0.6,
  "placements": [
    {
      "sequence": 0,
      "ingredient_id": "Bacon",
      "size": "Medium",
      "position": {"x": -3.0, "y": 1.0, "z": 0.0},
      "rotation": {"x": 0.0, "y": 0.0, "z": 0.0}
    },
    {
      "sequence": 1,
      "ingredient_id": "Chicken",
      "size": "Medium",
      "position": {"x": -3.0, "y": 1.0, "z": 0.0},
      "rotation": {"x": 0.0, "y": 45.0, "z": 0.0}
    }
  ]
}
